{
  "collection_counts": {
    "constructs.jsonl": 9334,
    "data_elements.jsonl": 194,
    "data_structures.jsonl": 36,
    "datasets.jsonl": 36,
    "relationships.jsonl": 43000,
    "resources.jsonl": 36,
    "semantic_nodes.jsonl": 41,
    "source_profiles.jsonl": 1,
    "sources.jsonl": 1,
    "variables.jsonl": 9334
  },
  "execution_ledger_fingerprint": "a9dbc3a93babd565a4de567b6b9bc6756f86c907cfb83f81741db00a1f5bbabe",
  "package_fingerprint": "e3de2fd56c8eb3b83b893550534f14ad56732e97896c0e81410d2e3c11e273fd",
  "plan_fingerprint": "e1c8dafe60d361ca6862612dba5b9231924237e7aba138e3caf234061af72a20",
  "prepared_at": "2026-08-21T04:37:30.840579+00:00",
  "project_id": "grdr:deep-map-project:undata-2026-08-21",
  "record_count": 62013,
  "schema_version": "1.0.0",
  "scope_fingerprint": "6e89435584ad360ecaca90b5e53d0d2bb7d8b980b40b515844a274f799d7c959",
  "source_id": "grdr:source:undata",
  "staging_manifest_fingerprint": "0be5a7f581800e34f6b5ddd6d34563328273b86ce8ac6718334b204042993c2c",
  "unit_manifest_fingerprint": "e91b880648c041b253eb878c92ec2863894575c110fa22b558da013de4340e89"
}
